{
  "$schema": "https://json-schema.org/draft/2020-12/schema",
  "$id": "https://github.com/agentic-delivery-lab/agentic-delivery-primitives/blob/main/evaluations/contracts/evaluation-catalog.schema.json",
  "title": "Offline evaluation source catalog v1",
  "type": "object",
  "additionalProperties": false,
  "required": ["$schema", "schemaVersion", "id", "version", "repository", "ownerIssue", "reportSchema", "artifacts"],
  "properties": {
    "$schema": { "const": "./contracts/evaluation-catalog.schema.json" },
    "schemaVersion": { "const": 1 },
    "id": { "type": "string", "pattern": "^[a-z0-9]+(?:-[a-z0-9]+)*$" },
    "version": { "type": "string", "pattern": "^(0|[1-9][0-9]*)\\.(0|[1-9][0-9]*)\\.(0|[1-9][0-9]*)(?:-[0-9A-Za-z.-]+)?$" },
    "repository": { "type": "string", "pattern": "^[A-Za-z0-9_.-]+/[A-Za-z0-9_.-]+$" },
    "ownerIssue": { "type": "string", "format": "uri", "pattern": "^https://github\\.com/agentic-delivery-lab/agentic-delivery-primitives/issues/3$" },
    "reportSchema": { "$ref": "#/$defs/sourcePin" },
    "artifacts": {
      "type": "array",
      "minItems": 1,
      "uniqueItems": true,
      "items": {
        "type": "object",
        "additionalProperties": false,
        "required": ["id", "version", "kind", "path", "sha256"],
        "properties": {
          "id": { "type": "string", "pattern": "^[a-z0-9]+(?:-[a-z0-9]+)*$" },
          "version": { "type": "string", "minLength": 1 },
          "kind": { "enum": ["contract", "dataset", "grader", "baseline", "comparator", "runner", "candidate"] },
          "path": { "type": "string", "minLength": 1, "pattern": "^(?!/)(?!.*(?:^|/)\\.\\.(?:/|$))[^\\s]+$" },
          "sha256": { "type": "string", "pattern": "^[0-9a-f]{64}$" }
        }
      }
    }
  },
  "$defs": {
    "sourcePin": {
      "type": "object",
      "additionalProperties": false,
      "required": ["repository", "commit", "path", "sha256"],
      "properties": {
        "repository": { "type": "string", "pattern": "^[A-Za-z0-9_.-]+/[A-Za-z0-9_.-]+$" },
        "commit": { "type": "string", "pattern": "^[0-9a-f]{40}$" },
        "path": { "type": "string", "minLength": 1, "pattern": "^(?!/)(?!.*(?:^|/)\\.\\.(?:/|$))[^\\s]+$" },
        "sha256": { "type": "string", "pattern": "^[0-9a-f]{64}$" }
      }
    }
  }
}
